{
  "annotator_kind": "AI_OPERATOR",
  "authority_class": "DEMOTED_AI_OPERATOR_NON_INDEPENDENT",
  "claim_boundary": "AI_OPERATOR / NON_INDEPENDENT Paper 1 reviews authorize only demoted process closeout. They do not mint independent external review, peer-review acceptance, or Constitution-grade review authority.",
  "close_recommendation": "CLOSE_UNDER_DEMOTED_AUTHORITY",
  "confirmatory_authority": false,
  "human_reviewers_present": false,
  "independence_class": "NON_INDEPENDENT",
  "independent_review_claimed": false,
  "issue": 216,
  "peer_review_acceptance": false,
  "responses": [
    "RESPONSE_AI_OPERATOR_FORMAL_METHODS.json",
    "RESPONSE_AI_OPERATOR_NOVELTY_PRIOR_ART.json",
    "RESPONSE_AI_OPERATOR_EDITORIAL_SIGNIFICANCE.json"
  ],
  "schema_version": "paper1-ai-operator-demoted-closeout-v1"
}
